id,productTitle,brand,price,description,descriptionImg,size,category1,category2,imageURL,totalRank,categoryRank,ingredients,productURL,affiliate,createdAt,updatedAT,reviewURL,checco_brand,similarity_score
739AB2A00A8311EE8F609F6D2CD4AF3A,[한정기획] [미미 PICK] 어반디케이 올나이터 세팅 픽서 올리브영 1+1 단독 기획,어반디케이,45000.0,,,,메이크업,베이스메이크업,https://image.oliveyoung.co.kr/uploads/images/goods/400/10/0000/0015/A00000015219505ko.jpg?l=ko,,,,https://www.oliveyoung.co.kr/store/goods/getGoodsDetail.do?goodsNo=A000000152195&dispCatNo=100000100020001,OLIVEYOUNG,2023-06-14 16:16:59,2023-06-14 16:16:59,,,
7537FB0109BC11EE91C7581122B79FAA,エアリーステイ BB ティント UV,ファシオ,1320.0,"SPF50+・PA++++
全3色
日やけ止め・化粧下地・ファンデーションの効果が1本になったBBティントです。ラスティング効果に優れているため、明るい美肌が長時間持続します。厚塗り感・白浮き感なく、気になる肌悩みを自然にカバーします。肌への親和性が高いスキンペアリング成分配合。高い紫外線防止効果をもちながらも、肌への負担感や乾燥感のない、なめらかな使用感を叶えました。軽いタッチのオイルをバランスよく配合することで、軽やかなのび広がりと心地よいフィット感を実現しました。柔軟性の高いラスティングキープ成分と、肌への付着性に優れたタッチプルーフ成分を配合。化粧膜が肌にピタッと密着し、マスクへの色移りを防ぎます。",,30g,日焼け対策・UVケア,日焼け止め・UVケア(顔用),https://fitter.cosme.net/media/product/10235/skuimg-d_83743.jpg?target=180x180,,42.0,,https://www.cosme.net/product/product_id/10235807/top,@COSME,2023-06-13 16:32:32,2023-06-13 20:05:03,,,
75C5314209BC11EEB42A581122B79FAA,スキンケアUV 01乾燥しがちな肌,SOFINA iP,,,,,日焼け対策・UVケア,日焼け止め・UVケア(顔用),,,48.0,,https://www.cosme.net/product/product_id/10234720/top,@COSME,2023-06-13 16:32:33,2023-06-13 17:41:53,,,
776114A409C711EEAC35581122B79FAA,プレミアムスリーク ヘアフレグランス,スティーブンノル,,,,,香水・フレグランス,香水・フレグランス(その他),,,31.0,,https://www.cosme.net/product/product_id/10106731/top,@COSME,2023-06-13 17:51:20,2023-06-13 17:51:20,,,
777B7E7209C711EE83DF581122B79FAA,エンジェルズ シェア オードパルファム,キリアン,,,,,香水・フレグランス,香水・フレグランス(その他),,,32.0,,https://www.cosme.net/product/product_id/10200180/top,@COSME,2023-06-13 17:51:20,2023-06-13 17:51:20,,,
77AA1F4209BD11EEA547581122B79FAA,アートクラスバイロダンシェーディングマスター,too cool for school,2090.0,ナチュラルな陰影とくっきりとした輪郭、立体感を表現できるアーティスティックなシェーディングパウダー。専用ブラシ付き。,,9.5g,ベースメイク,フェイスパウダー,https://fitter.cosme.net/media/product/10082/skuimg_871899.jpg?target=180x180,,34.0,,https://www.cosme.net/product/product_id/10082122/top,@COSME,2023-06-13 16:39:45,2023-06-13 20:07:09,,,
77D91CAA09BD11EEB73C581122B79FAA,リュクス ラディアンス ルース パウダー,ボビイ ブラウン,7920.0,"全3色
冬虫夏草* を配合したインテンシブ セラム ファンデーションのために開発された新ルースパウダー。3種類の微粒子マイカで構成されるトリプルパウダーコンプレックスでツヤ感を纏うマットの絶妙なバランスの仕上がりに。粉雪のような超微粒子パウダーは、ふんわりとしたクリーミーなテクスチャーで肌にすっと溶け込み、プライマーとファンデーションのツヤを損なうことなく肌表面を均一になめらかに整えてくすみのない透明感をUP。ヒアルロン酸とエモリエント成分がしっとりと肌に密着、ロングウェア パウダーが過剰な皮脂を吸着し付けている間中ストレスフリーの肌へ。コンパクトタイプのパウダーは携帯にも便利、ミラー、パフがついたラグジュアリーな仕様。*フユムシナツクサタケエキス（保湿成分）",,10g,ベースメイク,フェイスパウダー,https://fitter.cosme.net/media/product/10233/skuimg-d_79234.jpg?target=180x180,,36.0,,https://www.cosme.net/product/product_id/10233741/top,@COSME,2023-06-13 16:39:46,2023-06-13 20:07:30,,,
780C67DD0A8811EE8F609F6D2CD4AF3A,세븐피엠 남자옆머리누르기 매직모히칸,세븐피엠,10900.0,,,,헤어케어,스타일링,https://image.oliveyoung.co.kr/uploads/images/goods/400/10/0000/0012/A00000012122701ko.jpg?l=ko,,,,https://www.oliveyoung.co.kr/store/goods/getGoodsDetail.do?goodsNo=A000000121227&dispCatNo=100000100040011,OLIVEYOUNG,2023-06-14 16:52:54,2023-06-14 16:52:54,,,
7836D70909C711EEB1DD581122B79FAA,ブリュム ドゥ マロック ヘア & ボディフレグランスミスト,モロッカンオイル,,,,,香水・フレグランス,香水・フレグランス(その他),,,39.0,,https://www.cosme.net/product/product_id/10215782/top,@COSME,2023-06-13 17:51:21,2023-06-13 17:51:21,,,
7847130F09C911EEAE10581122B79FAA,Yakult(ヤクルト) 1000,ヤクルト,140.0,"研究開発・技術力を結集し、生きた「乳酸菌 シロタ株」を1本(100ml)に1,000億個含む乳製品乳酸菌飲料です。本品は、一時的な精神的ストレスがかかる状況での「ストレス緩和」「睡眠の質向上」の機能があります。",,100ml×7本/100ml,サプリメント・フード,フード,https://fitter.cosme.net/media/product/10173/skuimg_795830.jpg?target=180x180,,7.0,,https://www.cosme.net/product/product_id/10173371/top,@COSME,2023-06-13 18:05:40,2023-06-13 20:08:37,,,
7860E6AD0A8011EE8F609F6D2CD4AF3A,오우썸 리하이드레이팅 더블 미스트 세럼 120ml (2102),오우썸,18500.0,,,,스킨케어,미스트/오일,https://image.oliveyoung.co.kr/uploads/images/goods/400/10/0000/0014/A00000014922102ko.jpg?l=ko,,,,https://www.oliveyoung.co.kr/store/goods/getGoodsDetail.do?goodsNo=A000000149221&dispCatNo=100000100010010,OLIVEYOUNG,2023-06-14 15:55:38,2023-06-14 15:55:38,,,
786A83720A8911EE8F609F6D2CD4AF3A,오프드 대용량 디퓨저 300ml_1개입 퓨어코튼,오프드,10500.0,,,,향수/디퓨저,홈 프래그런스,https://image.oliveyoung.co.kr/uploads/images/goods/400/10/0000/0018/A00000018619701ko.jpg?l=ko,,,,https://www.oliveyoung.co.kr/store/goods/getGoodsDetail.do?goodsNo=A000000186197&dispCatNo=100000100050008,OLIVEYOUNG,2023-06-14 17:00:04,2023-06-14 17:00:04,,,
789780D209C911EEBE97581122B79FAA,キレートレモン,キレートレモン,124.0,レモン1個分の果汁がギュッと濃縮された、レモン本来のおいしさが楽しめる「瞬間レモン体感飲料」。飲んだ瞬間リフレッシュでき、前向きな気分に切り替えられる毎日を応援します。1本でビタミンCとクエン酸が1350mg摂れ、健康や美容に気を遣っている方にもおすすめ。,,155ml,サプリメント・フード,フード,https://fitter.cosme.net/media/product/308/skuimg_681682.jpg?target=180x180,,10.0,,https://www.cosme.net/product/product_id/308135/top,@COSME,2023-06-13 18:05:41,2023-06-13 20:08:57,,,
78E706620A8311EE8F609F6D2CD4AF3A,루나 롱래스팅 팁 컨실러 7.5g,루나,15000.0,,,,메이크업,베이스메이크업,https://image.oliveyoung.co.kr/uploads/images/goods/400/10/0000/0001/A00000001223969ko.jpg?l=ko,,,,https://www.oliveyoung.co.kr/store/goods/getGoodsDetail.do?goodsNo=A000000012239&dispCatNo=100000100020001,OLIVEYOUNG,2023-06-14 16:17:08,2023-06-14 16:17:08,,,
78E706640A8311EE8F609F6D2CD4AF3A,"[규진,규원 PICK / 단독기획] 자빈드서울 윙크 파운데이션 팩트 15g (본품+퍼프2개 증정)",자빈드서울,28000.0,,,,메이크업,베이스메이크업,https://image.oliveyoung.co.kr/uploads/images/goods/400/10/0000/0015/A00000015119211ko.jpg?l=ko,,,,https://www.oliveyoung.co.kr/store/goods/getGoodsDetail.do?goodsNo=A000000151192&dispCatNo=100000100020001,OLIVEYOUNG,2023-06-14 16:17:08,2023-06-14 16:17:08,,,
78E706650A8311EE8F609F6D2CD4AF3A,[올영단독/한정수량] 어뮤즈 듀 젤리 비건 쿠션 기획세트(본품15g+포켓쿠션10g),어뮤즈,34000.0,,,,메이크업,베이스메이크업,https://image.oliveyoung.co.kr/uploads/images/goods/400/10/0000/0016/A00000016172847ko.jpg?l=ko,,,,https://www.oliveyoung.co.kr/store/goods/getGoodsDetail.do?goodsNo=A000000161728&dispCatNo=100000100020001,OLIVEYOUNG,2023-06-14 16:17:08,2023-06-14 16:17:08,,,
7A0B64600A8B11EE8F609F6D2CD4AF3A,BBB 트리플블랙 전기면도기 X5 (간편면도),다다픽,49800.0,,,,남성,쉐이빙,https://image.oliveyoung.co.kr/uploads/images/goods/400/10/0000/0014/B00000014920020ko.jpg?l=ko,,,,https://www.oliveyoung.co.kr/store/goods/getGoodsDetail.do?goodsNo=B000000149200&dispCatNo=100000100070010,OLIVEYOUNG,2023-06-14 17:14:26,2023-06-14 17:14:26,,,
7A0B64610A8B11EE8F609F6D2CD4AF3A,쉬크 하이드로 쉐이브폼 250g*3입,쉬크,20700.0,,,,남성,쉐이빙,https://image.oliveyoung.co.kr/uploads/images/goods/400/10/0000/0018/A00000018686601ko.jpg?l=ko,,,,https://www.oliveyoung.co.kr/store/goods/getGoodsDetail.do?goodsNo=A000000186866&dispCatNo=100000100070010,OLIVEYOUNG,2023-06-14 17:14:26,2023-06-14 17:14:26,,,
7A69D6BC0A8411EE8F609F6D2CD4AF3A,[NEW/네일팁] 데싱디바 매직프레스 페디 골라담기,데싱디바,10800.0,,,,네일,팁/스티커,https://image.oliveyoung.co.kr/uploads/images/goods/400/10/0000/0018/A000000184917151ko.jpg?l=ko,,,,https://www.oliveyoung.co.kr/store/goods/getGoodsDetail.do?goodsNo=A000000184917&dispCatNo=100000100120006,OLIVEYOUNG,2023-06-14 16:24:20,2023-06-14 16:24:20,,,
7B09DFF90A8A11EE8F609F6D2CD4AF3A,탱글티저 웻 디탱글러밀레니얼 핑크,탱글티저,25000.0,,,,미용소품,헤어/바디소품,https://image.oliveyoung.co.kr/uploads/images/goods/400/10/0000/0012/A00000012682904ko.jpg?l=ko,,,,https://www.oliveyoung.co.kr/store/goods/getGoodsDetail.do?goodsNo=A000000126829&dispCatNo=100000100060002,OLIVEYOUNG,2023-06-14 17:07:18,2023-06-14 17:07:18,,,
7B09DFFA0A8A11EE8F609F6D2CD4AF3A,탱글엔젤 2.0 오리지널&파스텔 브러쉬 7종 택1,탱글엔젤,23000.0,,,,미용소품,헤어/바디소품,https://image.oliveyoung.co.kr/uploads/images/goods/400/10/0000/0016/A00000016181602ko.jpg?l=ko,,,,https://www.oliveyoung.co.kr/store/goods/getGoodsDetail.do?goodsNo=A000000161816&dispCatNo=100000100060002,OLIVEYOUNG,2023-06-14 17:07:18,2023-06-14 17:07:18,,,
7C051A630A8711EE8F609F6D2CD4AF3A,이브로쉐 호호바 리페어 트리트먼트 200ml (극손상모),이브로쉐,16500.0,,,,헤어케어,트리트먼트/팩,https://image.oliveyoung.co.kr/uploads/images/goods/400/10/0000/0013/A00000013535101ko.jpg?l=ko,,,,https://www.oliveyoung.co.kr/store/goods/getGoodsDetail.do?goodsNo=A000000135351&dispCatNo=100000100040007,OLIVEYOUNG,2023-06-14 16:45:51,2023-06-14 16:45:51,,,
7C93551A09C911EEBF0D581122B79FAA,美酢,美酢(ミチョ),1188.0,100％果実発酵のお酢から作った果実のおいしさを楽しむ飲むお酢です。水、炭酸水、牛乳、アルコールなどさまざまな割り材で割ってお好みのレシピをお楽しみください。,,900ml,サプリメント・フード,フード,https://fitter.cosme.net/media/product/10167/skuimg_907960.jpg?target=180x180,,11.0,,https://www.cosme.net/product/product_id/10167459/top,@COSME,2023-06-13 18:05:47,2023-06-13 20:09:44,,,
7CC7919B09C911EEB57F581122B79FAA,ひとつ上の豆乳 豆乳飲料,マルサンアイ,118.0,本当においしい豆乳のために国産プレミアム大豆「るりさやか」使用の豆乳飲料。,,200ml,サプリメント・フード,フード,https://fitter.cosme.net/media/product/10237/skuimg-d_86449.jpg?target=180x180,,13.0,,https://www.cosme.net/product/product_id/10237360/top,@COSME,2023-06-13 18:05:48,2023-06-13 20:10:18,,,
7CD04C6409C711EE8794581122B79FAA,プレミオール プロテクト スプレー,La Sana(ラサーナ),,,,,香水・フレグランス,香水・フレグランス(その他),,,44.0,,https://www.cosme.net/product/product_id/10219087/top,@COSME,2023-06-13 17:51:29,2023-06-13 17:51:29,,,
7CFB142A09C911EE9C3C581122B79FAA,フルグラ,カルビー,,,,,サプリメント・フード,フード,,,15.0,,https://www.cosme.net/product/product_id/305518/top,@COSME,2023-06-13 18:05:48,2023-06-13 18:05:48,,,
7D03E13209C711EE9290581122B79FAA,ナイトナイトバーム,Badger(バジャー),,,,,香水・フレグランス,香水・フレグランス(その他),,,46.0,,https://www.cosme.net/product/product_id/10013513/top,@COSME,2023-06-13 17:51:29,2023-06-13 17:51:29,,,
7D14FFEC09C911EEBD37581122B79FAA,マヌカハニーをそのまま包み込んだのど飴,マヌカプラス,648.0,ニュージーランド産の希少価値の高いマヌカハニーを使用したリッチな健康のど飴です。1粒あたりマヌカハニー500mgを配合しました。マヌカハニーが真ん中からゆっくりと溶けて香りと共にお口の中で風味がいっぱい広がります。稀にセンターインされているマヌカハニーのとろみを感じにくい場合がございます。,,73g(個包装),サプリメント・フード,フード,https://fitter.cosme.net/media/product/10150/skuimg_648456.jpg?target=180x180,,16.0,,https://www.cosme.net/product/product_id/10150507/top,@COSME,2023-06-13 18:05:48,2023-06-13 20:11:02,,,
7D60A6DD09C911EEAD0D581122B79FAA,豆乳飲料,キッコーマン,302.0,"豆乳に果汁やコーヒー・紅茶のエキスなどを加えた飲料です。
●季節限定品：さくら、マロン、焼きいも、おしるこ、甘酒、巨峰、あずき

【栄養機能食品】
フルーツミックス、ココア、黒ごま
【特定保健用食品】
カルシウムの多い豆乳飲料",,200ml/200ml/500ml/1000ml,サプリメント・フード,フード,https://fitter.cosme.net/media/product/2881/skuimg_745709.jpg?target=180x180,,19.0,,https://www.cosme.net/product/product_id/2881031/top,@COSME,2023-06-13 18:05:49,2023-06-13 20:11:34,,,
7E0E636E09C811EEACEE581122B79FAA,無料お試しセット,ドモホルンリンクル,,,,,コフレ・キット・セット,スキンケアキット,,,25.0,,https://www.cosme.net/product/product_id/10210631/top,@COSME,2023-06-13 17:58:40,2023-06-13 18:00:18,,,
7E27E07F09C811EE929D581122B79FAA,ドランク エレファント ザ リトルズ 5.0,ドランク エレファント,,,,,コフレ・キット・セット,スキンケアキット,,,32.0,,https://www.cosme.net/product/product_id/10214428/top,@COSME,2023-06-13 17:58:41,2023-06-13 17:58:41,,,
7E419AA009C811EEAC98581122B79FAA,HABA 香りさわやかアロマソープセット,ハーバー,,,,,コフレ・キット・セット,スキンケアキット,,,24.0,,https://www.cosme.net/product/product_id/10207922/top,@COSME,2023-06-13 17:58:41,2023-06-13 18:01:00,,,
7E75886C09C811EEBEAD581122B79FAA,チョコブラ スペシャル毛穴ケアセット,Chocobra,,,,,コフレ・キット・セット,スキンケアキット,,,35.0,,https://www.cosme.net/product/product_id/10223389/top,@COSME,2023-06-13 17:58:41,2023-06-13 17:58:41,,,
7E90F93609C811EE8D51581122B79FAA,デリケートセット,エンビロン,,,,,コフレ・キット・セット,スキンケアキット,,,36.0,,https://www.cosme.net/product/product_id/10086930/top,@COSME,2023-06-13 17:58:41,2023-06-13 17:58:41,,,
7EAA126A09C811EEA835581122B79FAA,7 day Special Set プログラム6(ニキビの後),b.glen(ビーグレン),,,,,コフレ・キット・セット,スキンケアキット,,,29.0,,https://www.cosme.net/product/product_id/10118944/top,@COSME,2023-06-13 17:58:41,2023-06-13 18:00:19,,,
7EC3FF3809C811EEB2D8581122B79FAA,リサージ コラゲリード セット30th,リサージ,,,,,コフレ・キット・セット,スキンケアキット,,,38.0,,https://www.cosme.net/product/product_id/10228842/top,@COSME,2023-06-13 17:58:42,2023-06-13 17:58:42,,,
7F7DDBD409BC11EEB6C5581122B79FAA,サンカットR プロテクトUV スプレー,サンカット(コーセーコスメポート),731.0,"SPF50+・PA++++
リニューアル発売
UVカット最強値なのに、エアリータッチでさらさらな使用感の日やけ止めスプレー。肌にしっかり密着し、花粉・ちり・ほこり・PM2.5等の環境ストレスからも守ります。",,60g/90g,日焼け対策・UVケア,日焼け止め・UVケア(ボディ用),https://fitter.cosme.net/media/product/10217/skuimg-d_49738.jpg?target=180x180,,20.0,,https://www.cosme.net/product/product_id/10217972/top,@COSME,2023-06-13 16:32:49,2023-06-13 20:13:04,,,
8161F16F09C711EEB2BD581122B79FAA,エッセンシャル ザビューティ バリアシャンプー,エッセンシャル,,,,,ヘアケア・スタイリング,シャンプー・コンディショナー,,,1.0,,https://www.cosme.net/product/product_id/10233878/top,@COSME,2023-06-13 17:51:36,2023-06-13 17:51:36,,,
817BDBB109C711EE964C581122B79FAA,プレミアムタッチ 浸透美容液ヘアマスク,フィーノ,,,,,ヘアケア・スタイリング,シャンプー・コンディショナー,,,2.0,,https://www.cosme.net/product/product_id/345572/top,@COSME,2023-06-13 17:51:37,2023-06-13 17:51:37,,,
817D48F20A8711EE8F609F6D2CD4AF3A,루시도엘 아르간 헤어 트리트먼트 크림 150g (노워시 트리트먼트),루시도엘,10000.0,,,,헤어케어,트리트먼트/팩,https://image.oliveyoung.co.kr/uploads/images/goods/400/10/0000/0001/A00000001403810ko.jpg?l=ko,,,,https://www.oliveyoung.co.kr/store/goods/getGoodsDetail.do?goodsNo=A000000014038&dispCatNo=100000100040007,OLIVEYOUNG,2023-06-14 16:46:00,2023-06-14 16:46:00,,,
8190C53309C911EEA5DB581122B79FAA,ウイダーinゼリー,ウイダー,324.0,すばやく手軽に栄養補給ができて、適度な腹持ちを提供するゼリー飲料です。,,120g/180g/180g/180g,サプリメント・フード,フード,https://fitter.cosme.net/media/product/288/233290.jpg?target=180x180,,21.0,,https://www.cosme.net/product/product_id/288850/top,@COSME,2023-06-13 18:05:56,2023-06-13 20:13:23,,,
8197CCB809C711EEB852581122B79FAA,ファンゴ ヘッドクレンズ SPA＋,プレディア,2200.0,天然ミネラル泥配合。頭皮ケア、シャンプー、トリートメントの3つの機能を凝縮した、ヘッドスパクリームです。泡立たない濃厚クリームがなめらかにのび広がりながら密着し、頭皮や毛穴のよごれをすっきり落とします。マッサージで頭皮の血行を促進し、ハリコシのある健やかな髪に導きます。海洋由来成分とハーブをふんだんに配合。健やかな毛髪が生まれる頭皮環境を整え、芯からしなやかでハリのある美しい髪に導きます。クレンジング成分＆2種の泥成分（フライブルクファンゴ、海洋性泥抽出エキス）が、頭皮や毛髪のよごれはもちろん、毛穴の皮脂づまりまでもしっかりからめ取り、すっきりと洗いあげます。すっきりとしたリフレッシュ感のあるハーバルグリーンフローラルの香り。,,30g/250g/500g/500g,ヘアケア・スタイリング,シャンプー・コンディショナー,https://fitter.cosme.net/media/product/10226/skuimg-d_66328.jpg?target=180x180,,3.0,,https://www.cosme.net/product/product_id/10226197/top,@COSME,2023-06-13 17:51:37,2023-06-13 20:13:30,,,
81A9C6AC09C911EEB60A581122B79FAA,オイコス,DANONE,,,,,サプリメント・フード,フード,,,22.0,,https://www.cosme.net/product/product_id/10107641/top,@COSME,2023-06-13 18:05:56,2023-06-13 18:05:56,,,
81B29C0509C711EE89AC581122B79FAA,カームナイトリペアブースターヘアミスト,YOLU,1540.0,お風呂の中と外でも使える2wayブースターヘアミストでまとまるうるツヤ髪を夜仕込む。ナノレベルで浸透。髪の内側まで集中補修。ジャスミン＆チュベローズの香り。,,200ml,ヘアケア・スタイリング,シャンプー・コンディショナー,https://fitter.cosme.net/media/product/10234/skuimg-d_80618.jpg?target=180x180,,3.0,,https://www.cosme.net/product/product_id/10234298/top,@COSME,2023-06-13 17:51:37,2023-06-13 20:13:43,,,
81CE7D1509C711EE8198581122B79FAA,メロウシャンプー／メロウトリートメント,plus eau（プリュスオー）,1650.0,とろけるような柔らかな質感と、毛先までツヤめくサラふわな指通りに導く美容液シャンプー＆浸透補修トリートメント。カシミヤ由来のケラチンをはじめとする3種のケラチン、シルクPPT＆コラーゲンPPT、CMC類似成分などのこだわって配合した補修成分だけでなく、セラミド、ヒアルロン酸、オーガニックオイルなどの美容保湿成分をたっぷり浸透させて密封補修することで、繰り返すカラーや熱ダメージによるパサつき・広がり・ゴワつきなどの蓄積ダメージにもしっかりアプローチ。補修ケアはもちろん、ダメージ毛にも配慮したなめらかな洗い心地を追求し、アミノ酸系洗浄成分だけでなくPPT系洗浄成分も贅沢配合のこだわり抜いた処方で、キシまずとろけるようになめらかな洗い上りに。髪の外部・内部から同時に髪の1本1本を包み込んでダメージ部分を疎水化することで、指通りやツヤ感だけでなく髪の質感を整えます。また熱を利用して髪を補修するヒートリペア成分も配合。ドライヤーなどの熱から髪を守り、同時にダメージケアも。清楚な上品さを纏うホワイトフローラル＆ペア―の香り。,,450ml,ヘアケア・スタイリング,シャンプー・コンディショナー,https://fitter.cosme.net/media/product/10225/skuimg-d_65655.jpg?target=180x180,,5.0,,https://www.cosme.net/product/product_id/10225824/top,@COSME,2023-06-13 17:51:37,2023-06-13 20:13:56,,,
81DCFC9E09C911EE977A581122B79FAA,ヘルシア myリズム アロマタイム,ヘルシア,,,,,サプリメント・フード,フード,,,24.0,,https://www.cosme.net/product/product_id/10234645/top,@COSME,2023-06-13 18:05:56,2023-06-13 18:05:56,,,
82108E8209C911EEB3F2581122B79FAA,キットカット,キットカット,648.0,"【キットカット ミニ】3枚 100円／14枚 500円
【キットカット バー】1本 100円
【キットカット ビッグリトル】45g 120円
サクッサクのウエハースとチョコレートのベストバランス。食べごたえのある「キットカット」をお届けします。

【キットカット ミニ オトナの甘さ】3枚 120円／13枚 500円
「クラッシュ・アンド・スプレッド」製法で、細かくクラッシュしたほろにが黒ビスケットを絶妙なバランスでチョコレート生地に練り込みました。深いカカオの香りと黒ビスケットがつくりだす「深く・本格的な」オトナの味わいをお愉しみください。

【キットカット ミニ オトナの甘さ 抹茶】12枚 500円
練りこみ茶葉増量。「宇治玉露茶葉」を宇治抹茶風味ベースの生地に練り込むことで、香り高い宇治抹茶の味と香りを引き立たせました。「より深く・本格的な」オトナの宇治抹茶の味わいをお愉しみください。",,1本/3枚/3枚/12枚/13枚/13枚/14枚/45g/105g,サプリメント・フード,フード,https://fitter.cosme.net/media/product/2905/230864.jpg?target=180x180,,26.0,,https://www.cosme.net/product/product_id/2905452/top,@COSME,2023-06-13 18:05:57,2023-06-13 20:14:31,,,
8252376B09C711EEBE00581122B79FAA,オイルインシャンプー／コンディショナー(リッチ＆リペア),ディアボーテ,,,,,ヘアケア・スタイリング,シャンプー・コンディショナー,,,10.0,,https://www.cosme.net/product/product_id/10166895/top,@COSME,2023-06-13 17:51:38,2023-06-13 17:51:38,,,
827B39F509C911EE82F7581122B79FAA,オーガニック デーツシロップ,SUNSET DATES(サンセットデーツ),1080.0,"糖尿病・肥満予防として脚光を浴びる低GI*のデーツは、砂糖の代わりながら同時に食物繊維、マグネシウム、カリウムや葉酸などがたっぷり摂れてしまう栄養つまったフルーツです。そんなデーツを毎日に取り入れやすいシロップに仕上げました。離乳食からシニア食、妊婦さんからアスリートまでどなたでも安心して食べられます。アメリカ・カリフォルニア州のオーガニックデーツ農園でとれる最上級マジョール種を使用。はちみつの代わりとしてコーヒーや紅茶の甘味料使いから、ヨーグルトやトーストにかけたり、みりんやお砂糖の代わりに和食の甘味つけ、スイーツ作りに使ったりなど。デーツシロップの使い方はさまざまです。食品添加物、着色料、保存料不使用。
*グリセミック・インデックス(Glycemic Index)の略で、食後血糖値の上昇度を示す指数のことです。",,15本/210ml,サプリメント・フード,フード,https://fitter.cosme.net/media/product/10237/skuimg-d_87583.jpg?target=180x180,,30.0,,https://www.cosme.net/product/product_id/10237770/top,@COSME,2023-06-13 18:05:57,2023-06-13 20:15:04,,,
