id,productTitle,brand,price,description,descriptionImg,size,category1,category2,imageURL,totalRank,categoryRank,ingredients,productURL,affiliate,createdAt,updatedAT,reviewURL,checco_brand,similarity_score
000020EA0A5511EE8DE7F220AFBB7B6D,カネボウルナソルグロウイングデイクリームUV SPF40PA+++ 40g【メール便は使えません】,,5025.0,,,,ベースメイク・メイクアップ,化粧下地,https://tshop.r10s.jp/pureco/cabinet/prc-s-843000/prc-s-8436887968.jpg?fitin=128:128,,229.0,,https://item.rakuten.co.jp/pureco/prc-s-8436887968/,RAKUTEN,2023-06-14 10:44:29,2023-06-16 10:32:18,https://review.rakuten.co.jp/item/1/206030_10062525,,
00A0701C0A8311EE8F609F6D2CD4AF3A,바이오더마 포토덤 크림 SPF50+ 40ml,바이오더마,30000.0,,,40ml,더모 코스메틱,선케어,https://image.oliveyoung.co.kr/uploads/images/goods/400/10/0000/0017/A00000017133403ko.jpg?l=ko,,,"정제수, 디에칠아미노하이드록시벤조일헥실벤조에이트, 호모살레이트, 다이아이소프로필세바케이트, 비스-에칠헥실옥시페놀메톡시페닐트리아진, 다이부틸아디페이트, 프로판다이올, 에칠헥실살리실레이트, 에칠헥실트리아존, 글리세린, 실리카, 티타늄디옥사이드, 수크로오스라우레이트, 운데케인, C20-22알킬포스페이트, 소듐스테아로일글루타메이트, C20-22알코올, 소듐폴리아크릴레이트, 트라이데케인, 카프릴로일글라이신, 소듐하이드록사이드, 소듐시트레이트, 카프릴릴글라이콜, 엑토인, 만니톨, 자일리톨, 람노오스, 소듐라우로일글루타메이트, 라이신, 마그네슘클로라이드, 프룩토올리고사카라이드, 카프릴릭/카프릭트라이글리세라이드, 토코페롤, 해바라기씨오일, 라미나리아 오크롤레우카추출물",https://www.oliveyoung.co.kr/store/goods/getGoodsDetail.do?goodsNo=A000000171334&dispCatNo=100000100080005,OLIVEYOUNG,2023-06-14 16:13:46,2023-06-16 11:19:00,https://www.oliveyoung.co.kr/store/goods/getGoodsDetail.do?goodsNo=A000000171334&dispCatNo=100000100080005,,
00A0701D0A8311EE8F609F6D2CD4AF3A,[1+1기획] 피지오겔 DMT 마일드 릴리프 UV 썬스크린 40ml 더블기획,피지오겔,56000.0,,,40ml+40ml,더모 코스메틱,선케어,https://image.oliveyoung.co.kr/uploads/images/goods/400/10/0000/0018/A00000018637802ko.jpg?l=ko,,,"정제수, 징크옥사이드, 다이메티콘, 부틸옥틸살리실레이트, 폴리글리세릴-3폴리다이메틸실록시에틸다이메티콘, 다이프로필렌글라이콜, 글리세린, 라우릴폴리글리세릴-3폴리다이메틸실록시에틸다이메티콘, 1,2-헥산다이올, 다이스테아다이모늄헥토라이트, 판테놀, 폴리메틸실세스퀴옥세인, 다이메티콘/폴리글리세린-크로스폴리머, 트라이에톡시카프릴릴실레인, 벤조트라이아졸릴도데실P-크레솔, 피씨에이다이메티콘, 카프릴릭/카프릭트라이글리세라이드, 다이스테아릴다이모늄클로라이드, 아세타마이드엠이에이, 베티버뿌리오일, 육두구추출물, 팔미타마이드엠이에이, 사코신, 스쿠알란, 소듐시트레이트, 후추열매오일, 토코페롤, 생강오일, 마데카소사이드, 육계잎오일, 세라마이드엔피, 하이드로제네이티드레시틴, 다마스크장미꽃오일",https://www.oliveyoung.co.kr/store/goods/getGoodsDetail.do?goodsNo=A000000186378&dispCatNo=100000100080005,OLIVEYOUNG,2023-06-14 16:13:46,2023-06-16 11:46:53,https://www.oliveyoung.co.kr/store/goods/getGoodsDetail.do?goodsNo=A000000186378&dispCatNo=100000100080005,,
00FEB1BE0A8711EE8F609F6D2CD4AF3A,팬틴 극손상케어 컨디셔너 500ml,팬틴,12300.0,,,■ 500ml,헤어케어,샴푸/린스,https://image.oliveyoung.co.kr/uploads/images/goods/400/10/0000/0001/A00000001592308ko.jpg?l=ko,,,"■ 정제수,비스-아미노프로필메치콘,스테아릴알코올,베헨트리모늄메토설페이트,세틸알코올,향료,이소프로필알코올,벤질알코올,디소?이디티에이,판테놀,라이신에이치씨엘,황색5호",https://www.oliveyoung.co.kr/store/goods/getGoodsDetail.do?goodsNo=A000000015923&dispCatNo=100000100040008,OLIVEYOUNG,2023-06-14 16:42:24,2023-06-16 12:13:06,https://www.oliveyoung.co.kr/store/goods/getGoodsDetail.do?goodsNo=A000000015923&dispCatNo=100000100040008,,
00FEB1BF0A8711EE8F609F6D2CD4AF3A,클로란 갈랑가 안티 댄드러프 샴푸 400ml,클로란,26000.0,,,400ml,헤어케어,샴푸/린스,https://image.oliveyoung.co.kr/uploads/images/goods/400/10/0000/0017/A00000017422208ko.jpg?l=ko,,,"정제수,다이소듐라우레스설포석시네이트,데실글루코사이드,라우릴베타인,세테아레스-60미리스틸글라이콜,락틱애씨드,펜틸렌글라이콜,갈랑가갈랑갈뿌리줄기추출물,향료,라우레스-3,말레익애씨드,말토덱스트린,올레스-10,폴리쿼터늄-22,적색227호,소듐벤조에이트,소듐클로라이드,소듐하이드록사이드,토코페롤",https://www.oliveyoung.co.kr/store/goods/getGoodsDetail.do?goodsNo=A000000174222&dispCatNo=100000100040008,OLIVEYOUNG,2023-06-14 16:42:25,2023-06-16 12:44:17,https://www.oliveyoung.co.kr/store/goods/getGoodsDetail.do?goodsNo=A000000174222&dispCatNo=100000100040008,湘南美容,100.0
00FEB1C00A8711EE8F609F6D2CD4AF3A,라우쉬 콜츠푸트 안티-댄드러프 린스 컨디셔너 200ml,라우쉬,26000.0,,,200ml,헤어케어,샴푸/린스,https://image.oliveyoung.co.kr/uploads/images/goods/400/10/0000/0017/A00000017399701ko.jpg?l=ko,,,"정제수,세테아릴알코올,베헨트라이모늄메토설페이트,브라시카알코올,발삼코파이바수지,우엉뿌리추출물,관동화잎추출물,귀리커넬추출물,브라질넛씨오일,글리세린,자일리틸글루코사이드,판테닐에틸에터,안하이드로자일리톨,판테놀,피록톤올아민,자일리톨,하이드롤라이즈드식물성단백질,브라시실아이소류시네이트에실레이트,브라시카미도프로필다이메틸아민,변성알코올,락틱애씨드,페녹시에탄올,벤조익애씨드,소듐벤조에이트,향료,리날룰,헥실신남알,제라니올",https://www.oliveyoung.co.kr/store/goods/getGoodsDetail.do?goodsNo=A000000173997&dispCatNo=100000100040008,OLIVEYOUNG,2023-06-14 16:42:25,2023-06-16 13:04:03,https://www.oliveyoung.co.kr/store/goods/getGoodsDetail.do?goodsNo=A000000173997&dispCatNo=100000100040008,,
00FEB1C10A8711EE8F609F6D2CD4AF3A,라이아 탈모증상완화 두피코어강화 프로알테인 단백질 샴푸 400ml,라이아,20000.0,,,400ml,헤어케어,샴푸/린스,https://image.oliveyoung.co.kr/uploads/images/goods/400/10/0000/0017/A00000017432016ko.jpg?l=ko,,,"정제수, 다이소듐라우레스설포석시네이트, 라우릴하이드록시설테인, 코카마이드메틸엠이에이, 글리세린, 소듐코코일이세티오네이트, 에탄올, 폴리쿼터늄-22, 향료, 피이지-45팜커넬글리세라이즈, 덱스판테놀, 멘톨, 폴리쿼터늄-10, 피이지-120메틸글루코스디올리에이트, 세트리모늄클로라이드, 징크피리치온, 카프릴릴글라이콜, 살리실릭애씨드, 소듐클로라이드, 코카미도프로필베타인, 트라이하이드록시스테아린, 다이소듐이디티에이, 징크클로라이드, 유칼립투스잎오일, 시트릭애씨드, 에틸헥실글리세린, 피이지-6카프릴릭/카프릭글리세라이즈, 부틸렌글라이콜, 소듐폴리나프탈렌설포네이트, 리모넨, 1,2-헥산다이올, 글라이신, C12-13알킬락테이트, 프로판다이올, 다이소듐포스페이트, 세린, 글루타믹애씨드, 하이드롤라이즈드콩단백질, 하이드롤라이즈드익스텐신, 하이드롤라이즈드쌀단백질, 하이드롤라이즈드옥수수단백질, 하이드롤라이즈드감자단백질, 하이드롤라이즈드콜라겐, 아스파틱애씨드, 류신, 알라닌, 라이신, 알지닌, 타이로신, 페닐알라닌, 트레오닌, 프롤린, 발린, 아이소류신, 히스티딘, 메티오닌, 시스테인, 하이드롤라이즈드케라틴, 토코페롤, 에스에이치-올리고펩타이드-1, 에스에이치-폴리펩타이드-9, 에스에이치-폴리펩타이드-3, 에스에이치-폴리펩타이드-11, 에스에이치-폴리펩타이드-1, 에스에이치-올리고펩타이드-2, 에스에이치-폴리펩타이드-22, 카페인",https://www.oliveyoung.co.kr/store/goods/getGoodsDetail.do?goodsNo=A000000174320&dispCatNo=100000100040008,OLIVEYOUNG,2023-06-14 16:42:25,2023-06-16 13:32:10,https://www.oliveyoung.co.kr/store/goods/getGoodsDetail.do?goodsNo=A000000174320&dispCatNo=100000100040008,,
0208C5EE0A8811EE8F609F6D2CD4AF3A,씨드비 프리미엄 물염색 내추럴 블랙 30g (10g 3포),씨드비,17000.0,,,30g (10gx3포),헤어케어,염색약/펌,https://image.oliveyoung.co.kr/uploads/images/goods/400/10/0000/0016/A00000016532604ko.jpg?l=ko,,,"옥수수전분, 솔비톨, 말토덱스트린, 셀룰로오스검, 과붕산나트륨, 소듐설페이트, 자일리톨, p-페닐렌디아민, 소듐폴리아크릴레이트, o-아미노페놀, 녹차가루, 살비아잎, 시카카이열매가루, 율무씨가루, 검정콩가루, 쌀가루, p-아미노페놀, 레조시놀, 팥가루, 검은깨가루, 고삼가루, 귀리커넬가루, 녹두가루, 라벤더꽃가루, 레몬밤잎가루, 로즈마리잎가루, 마트리카리아꽃가루, 메밀가루, 바질잎가루, 보리가루, 서양자초잎가루, 스페인감초뿌리가루, 아스코빅애씨드, 알로에베라잎즙가루, 유칼립투스잎가루, 커먼자스민꽃가루, 타임잎/줄기가루, 판테놀, 한련초잎가루, 다시마가루, 바이오틴, 멕시칸치아씨가루, 미역가루, 효모, 양까막까치밥나무열매가루, 라벤더오일, 리날룰, 다이소듐이디티에이, 소나무잎추출물, 쑥잎추출물, 은행나무잎추출물, 천궁뿌리추출물, 칡뿌리추출물, 부틸렌글라이콜, 1,2-헥산다이올, 정제수",https://www.oliveyoung.co.kr/store/goods/getGoodsDetail.do?goodsNo=A000000165326&dispCatNo=100000100040010,OLIVEYOUNG,2023-06-14 16:49:36,2023-06-16 14:03:49,https://www.oliveyoung.co.kr/store/goods/getGoodsDetail.do?goodsNo=A000000165326&dispCatNo=100000100040010,,
0208C5F00A8811EE8F609F6D2CD4AF3A,헤어플러스 컬러본드 보색 에센스 95ml,헤어플러스,12900.0,,,95ml,헤어케어,염색약/펌,https://image.oliveyoung.co.kr/uploads/images/goods/400/10/0000/0013/A00000013572407ko.jpg?l=ko,,,"정제수, 사이클로펜타실록세인, 미리스틸알코올, 아이소프로필미리스테이트, 피마자씨오일, 다이프로필렌글라이콜, 다이메티콘, 자수정추출물, 가지 열매 추출물, 로우스위트 블루베리 추출물, 뽕나무 열매 추출물, 자두 추출물, 포도 추출물, 코치닐 선인장 열매 추출물, 아보카도 오일, 코코넛 오일, 호호바씨오일, 베르가못오일, 센티드제라늄꽃오일, 비터오렌지꽃오일, 연필향나무오일, 로즈우드오일, 장미꽃오일, 백미꽃추출물, 토코페릴아세테이트, 아스코빅애씨드, 백미꽃추출물, 실크가루, 누에고치추출물, 하이드롤라이즈드실크, 우유단백질추출물, 하이드롤라이즈드밀단백질, 하이드롤라이즈드쌀단백질, 하이드롤라이즈드콩단백질, 하이드롤라이즈드엘라스틴, 하이드롤라이즈드케라틴, 하이드롤라이즈드콜라겐, 케라틴아미노산, 스테아트리모늄클로라이드, 프로필렌글라이콜, 폴리솔베이트80, 다이소듐이디티에이, 부틸렌글라이콜, 염기성청색99호, 염기성적색51호, 1,2-헥산다이올, 클로헥시딘다이글루코네이트, 향료",https://www.oliveyoung.co.kr/store/goods/getGoodsDetail.do?goodsNo=A000000135724&dispCatNo=100000100040010,OLIVEYOUNG,2023-06-14 16:49:36,2023-06-16 14:54:07,https://www.oliveyoung.co.kr/store/goods/getGoodsDetail.do?goodsNo=A000000135724&dispCatNo=100000100040010,,
0208C5F10A8811EE8F609F6D2CD4AF3A,베네자임 물로하는 쑥염색 7.0 내추럴브라운,베네자임,12000.0,,,10gx3,헤어케어,염색약/펌,https://image.oliveyoung.co.kr/uploads/images/goods/400/10/0000/0016/A00000016523402ko.jpg?l=ko,,,"사철쑥가루(430,000ppm), 소듐카보네이트퍼옥사이드, 소듐설페이트, 셀룰로오스검, 황산p-페닐렌디아민, 소듐아스코베이트, 황산p-아미노페놀, 다시마가루(20,000ppm), 레조시놀, 다이소듐라우릴설포석시네이트, 황산m-아미노페놀, 마그네슘스테아레이트

",https://www.oliveyoung.co.kr/store/goods/getGoodsDetail.do?goodsNo=A000000165234&dispCatNo=100000100040010,OLIVEYOUNG,2023-06-14 16:49:36,2023-06-15 22:24:40,https://www.oliveyoung.co.kr/store/goods/getGoodsDetail.do?goodsNo=A000000165234&dispCatNo=100000100040010,,
02857E7A0A8011EE8F609F6D2CD4AF3A,넘버즈인 2번 시카마이드 장벽 딥페어크림 60ml,넘버즈인,30000.0,,,60ml,스킨케어,에센스/크림,https://image.oliveyoung.co.kr/uploads/images/goods/400/10/0000/0017/A00000017443601ko.jpg?l=ko,,,"정제수, 글리세린, 시어버터, 세테아릴알코올, 다이프로필렌글라이콜, 카프릴릭/카프릭트라이글리세라이드, 하이드로제네이티드폴리(C6-14올레핀), 메틸트라이메티콘, 1,2-헥산다이올, 나이아신아마이드, 식물성오일, 페닐트라이메티콘, 하이드로제네이티드폴리데센, 팔미틱애씨드, 글리세릴스테아레이트에스이, 세라마이드엔피, 병풀추출물, 마데카소사이드, 아시아티코사이드, 마데카식애씨드, 아시아틱애씨드, 무화과추출물, 다시마추출물, 한련초잎추출물, 올레라케아아크멜라추출물, 당느릅나무뿌리추출물, 줄맨드라미씨추출물, 하이드로제네이티드레시틴, 소듐하이알루로네이트, 퀸즈랜드넛오일, 오일팜오일, 바오밥나무씨오일, 아보카도오일, 스테아릭애씨드, 세테아릴올리베이트, 솔비탄올리베이트, 베헤닐알코올, C12-16알코올, 알파-비사보롤, 실리카, 마이크로크리스탈린셀룰로오스, 세테아릴글루코사이드, 부틸렌글라이콜, 암모늄아크릴로일다이메틸타우레이트/브이피코폴리머, 글리세릴폴리메타크릴레이트, 셀룰로오스검, 콜레스테롤, 프룩토올리고사카라이드, 다이소듐이디티에이, 베타-글루칸, 미리스틱애씨드, 하이드롤라이즈드하이알루로닉애씨드, 글루코오스, 에탄올, 피토스핑고신, 에틸헥실글리세린",https://www.oliveyoung.co.kr/store/goods/getGoodsDetail.do?goodsNo=A000000174436&dispCatNo=100000100010009,OLIVEYOUNG,2023-06-14 15:52:21,2023-06-15 22:50:17,https://www.oliveyoung.co.kr/store/goods/getGoodsDetail.do?goodsNo=A000000174436&dispCatNo=100000100010009,,
02857E7B0A8011EE8F609F6D2CD4AF3A,[마스크팩 증정]리쥬란힐러 턴오버 앰플 듀얼 이펙트 30ml 기획,리쥬란,59000.0,,,30ml,스킨케어,에센스/크림,https://image.oliveyoung.co.kr/uploads/images/goods/400/10/0000/0018/A00000018040703ko.jpg?l=ko,,,"서양산딸기잎추출물, 스페인감초뿌리추출물, 포트마리골드꽃추출물, 알로에베라잎즙, 로우스위트블루베리추출물, 검은뽕나무열매추출물, 알부틴, 부틸렌글라이콜, 글리세린, 폴리솔베이트20, 하이드롤라이즈드디엔에이, 제로틴/하이드롤라이즈드디엔에이, 소듐하이알루로네이트, 카보머, 잔탄검, 아데노신, 토코페릴아세테이트, 나이아신아마이드, 비사보롤, 피이지-6, 정제수, 카프릴릴글라이콜, ㅔ틸헥실글리세린, 헥실렌글라이콜, 1,2-헥산다이올, 다이프로필렌글라이콜, 소듐클로라이드, 트레할로오스, 우레아, 세린, 펜틸렌글라이콜, 글리세릴폴리아크릴레이트, 알진, 풀루란, 다이소듐포스페이트, 포타슘포스페이트, 스쿠알란, 하이드로제네이티드레시틴, 세라마이드엔피, 올레익애씨드, 이눌린라우릴카바메이트, 콜레스테롤
",https://www.oliveyoung.co.kr/store/goods/getGoodsDetail.do?goodsNo=A000000180407&dispCatNo=100000100010009,OLIVEYOUNG,2023-06-14 15:52:21,2023-06-15 23:13:47,https://www.oliveyoung.co.kr/store/goods/getGoodsDetail.do?goodsNo=A000000180407&dispCatNo=100000100010009,,
02857E7C0A8011EE8F609F6D2CD4AF3A,[뷰티마스터 한창서 PICK] 닥터리핏 입체돌기 당김실 탄력 리프팅 콜라겐실 앰플 아쿠아미니,닥터리핏,33600.0,,,,스킨케어,에센스/크림,https://image.oliveyoung.co.kr/uploads/images/goods/400/10/0000/0017/A00000017431710ko.jpg?l=ko,,,,https://www.oliveyoung.co.kr/store/goods/getGoodsDetail.do?goodsNo=A000000174317&dispCatNo=100000100010009,OLIVEYOUNG,2023-06-14 15:52:21,2023-06-14 15:52:21,,Charleville,53.0
02857E7D0A8011EE8F609F6D2CD4AF3A,닥터지 레드블레미쉬 클리어 모이스처 크림 70ml+50ml 한정기획,닥터지,39000.0,,,70ml+50ml,스킨케어,에센스/크림,https://image.oliveyoung.co.kr/uploads/images/goods/400/10/0000/0017/A00000017420323ko.jpg?l=ko,,,"정제수, 글리세린, 2,3-부탄다이올, 하이드로제네이티드폴리(C6-14올레핀), 병풀추출물, 나이아신아마이드, 베타인, 비닐다이메티콘, 사이클로헥사실록세인, 1,2-헥산다이올, 세틸에틸헥사노에이트, 하이드로제네이티드폴리데센, 호호바에스터, 하이드로제네이티드레시틴, 소듐하이알루로네이트, 마카다미아씨오일, 하이드로제네이티드채종유, 카프릴릭/카프릭트라이글리세라이드, 하이드록시에틸아크릴레이트/소듐아크릴로일다이메틸타우레이트코폴리머, 헥실데실라우레이트, 헥실데칸올, 실리카, 암모늄아크릴로일다이메틸타우레이트/브이피코폴리머, C14-22알코올, 아라키딜알코올, 팔미틱애씨드, C12-20알킬글루코사이드, 글리세릴스테아레이트, 다이프로필렌글라이콜, 알란토인, 스테아릭애씨드, 베헤닐알코올, 아라키딜글루코사이드, 카보머, 소듐스테아로일글루타메이트, 솔비탄아이소스테아레이트, 다이소듐이디티에이, 판테놀, 수크로오스다이스테아레이트, 부틸렌글라이콜, 글루코오스, 미리스틱애씨드, 세라마이드엔피, 마데카소사이드, 아시아티코사이드, 마데카식애씨드, 아시아틱애씨드, 피토스핑고신, 하이드록시아세토페논, 에틸헥실글리세린",https://www.oliveyoung.co.kr/store/goods/getGoodsDetail.do?goodsNo=A000000174203&dispCatNo=100000100010009,OLIVEYOUNG,2023-06-14 15:52:21,2023-06-16 00:05:46,https://www.oliveyoung.co.kr/store/goods/getGoodsDetail.do?goodsNo=A000000174203&dispCatNo=100000100010009,,
0310E4FA0A8611EE8F609F6D2CD4AF3A,카멕스 모이스처라이징 립밤 클래식 튜브,카멕스,4500.0,,,■10g,바디케어,립케어,https://image.oliveyoung.co.kr/uploads/images/goods/400/10/0000/0001/A00000001314702ko.jpg?l=ko,,,"■페트롤라툼, 라놀린, 세틸에스터, 카카오씨버터, 미네랄오일, 세라알바, 캠퍼, 멘톨, 살리실릭애씨드(0.44%), 향료, 바닐린, 시트로넬올, 제라니올, 하이드록시시트로넬알, 리모넨, 리날룰",https://www.oliveyoung.co.kr/store/goods/getGoodsDetail.do?goodsNo=A000000013147&dispCatNo=100000100030008,OLIVEYOUNG,2023-06-14 16:35:18,2023-06-16 00:32:14,https://www.oliveyoung.co.kr/store/goods/getGoodsDetail.do?goodsNo=A000000013147&dispCatNo=100000100030008,M·A·C(マック),52.0
